Date,Category,Person,Tool,IDE,Task / Use Case,AI Usage Description,Outcome,Time Spent,Estimated Impact
2026-03-17,Architecture,[Person],[Copilot],[IDE],"Architecture design for schedule viewer refactor — CSV import, hierarchical team/VS filtering, per-day navigation, color coding, current-time indicator","Explored full codebase (index.html, script.js, styles.css, rooms.json, room2.json). Identified 4 key limitations (single-team filter, no multi-day, JSON-only, limited CSS). Evaluated 3 design approaches (ES Modules multi-file, single-file expansion, global namespace multi-script). Produced architecture design document with canonical event schema, 6 module specifications (loader, filter, url-state, renderer, time-indicator, app orchestrator), data flow diagram, hierarchical filter logic, color palette, error handling strategy, testing strategy, and risk analysis. Saved to artifacts/2026-03-17-schedule-architecture.md with handoff for @ema-planner.",Working code produced — architecture document complete with all sections; requirements artifact and architecture artifact saved to artifacts/,[Time Spent],"Time saved ≈ 50-60% — AI handled codebase exploration, data model analysis, approach comparison, and document generation rapidly; human review still needed for correctness of filter logic interpretation, VS naming conventions, and architectural trade-off validation (~45min AI-assisted vs ~1.5h fully manual)"
2026-03-17,Technical architecture and design,[Person],Copilot,[IDE],"Implementation planning for schedule viewer refactor — ES modules, CSV import, hierarchical filters, URL state, colors, current-time indicator","Verified architecture handoff against the actual repo files (index.html, script.js, styles.css, rooms.json, room2.json, requirements artifact). Resolved one design mismatch by keeping control generation inside app.js instead of adding js/controls.js. Produced a detailed 7-step implementation plan with exact files to create and modify, named function signatures, testing approach, integration points, and handoff instructions for @ema-implementer. Saved to artifacts/2026-03-17-schedule-plan.md.",Working code produced — implementation plan artifact completed with 7 atomic steps and implementer handoff,[Time Spent],"Time saved ≈ 45-55% — AI converted the architecture into an executable file-by-file plan quickly; human review is still needed for sequencing, test scope, and edge-case prioritization (~30min AI-assisted vs ~1h manual planning)"
2026-03-17,Development,[Person],Copilot,[IDE],"Implement schedule viewer refactor with ES modules, CSV import, hierarchical filtering, URL persistence, VS colors, and current-time indicator","ema-implementer executed 7-step plan: created config/sources.json and config/colors.json; added test-data/sample.csv; implemented js/loader.js for JSON/CSV loading, normalization, validation, deduplication, and VS/team alias handling; implemented js/filter.js for all/plenary/VS/team filtering; implemented js/url-state.js for query string and localStorage persistence; implemented js/renderer.js for DOM-safe card and legend rendering; implemented js/time-indicator.js for current-time insertion; created app.js to wire controls, import flow, rendering, and state; updated index.html and styles.css for the new UI shell; converted script.js into a legacy stub; added browser smoke tests in test.html; verified behavior through headless Edge and a local Node static server.",Working code produced — 7/7 steps completed, 13 files created or modified, smoke tests passing,[Time Spent],"Time saved ≈ 55-65% — AI accelerated the end-to-end static app refactor, module scaffolding, and browser smoke verification; developer still reviews UX details, edge-case semantics, and long-term maintainability (~2h AI-assisted vs ~5h manual)"
2026-03-17,Development,[Person],Copilot,[IDE],"Rename schedule product field to topics across data and runtime model","Refactored the canonical schedule field from product to topics across rooms.json, room2.json, test-data/sample.csv, js/loader.js, js/filter.js, js/renderer.js, index.html, test.html, and the implementation artifact. Kept backward-compatible import support by allowing js/loader.js to read legacy product fields while normalizing to topics. Re-ran diagnostics and browser-based smoke verification with a local Node static server and headless Edge.",Working code produced — field rename completed across data and runtime code, smoke tests passing,[Time Spent],"Time saved ≈ 35-45% — AI handled the cross-file rename, compatibility adjustment, and browser verification quickly; developer still reviews naming consistency and downstream documentation impact (~20min AI-assisted vs ~35min manual)"
2026-03-19,Architecture,[Person],Copilot,[IDE],"Update SAGE requirements and architecture — remove CSV upload UI, add data/ folder structure with CSV-preferred loading, add SAGE branding","Updated artifacts/2026-03-17-schedule-requirements.md to remove all CSV upload/import references, define data/csv/ and data/json/ folder structure with CSV-preferred loading convention, add SAGE branding requirements, and clarify that data is repo-committed only. Created artifacts/2026-03-19-sage-branding-data-reorg-architecture.md with 3 design approaches evaluated (name-based convention, explicit dual paths, auto-discovery manifest), chose name-based convention. Architecture covers changes to 7 existing files (index.html, app.js, js/loader.js, config/sources.json, styles.css, rooms.json, room2.json), data flow diagram, error handling, testing strategy, and detailed planner handoff.",Working code produced — requirements updated and architecture document complete with handoff for @ema-planner,[Time Spent],"Time saved ≈ 45-55% — AI handled codebase re-exploration, requirements rewriting, and architecture generation with proper trade-off analysis; developer still reviews correctness of data loading convention, branding decisions, and handoff completeness (~30min AI-assisted vs ~1h manual)"
2026-03-19,Technical architecture and design,[Person],Copilot,[IDE],"Implementation planning for SAGE branding and data reorganization — remove upload UI, move data under data/, prefer CSV over JSON","Verified the architecture handoff against the current repo files (index.html, app.js, js/loader.js, config/sources.json, styles.css, rooms.json, room2.json, test.html). Confirmed the upload control and import workflow are still present, confirmed the loader is still JSON-only and file-path based, identified that root-level schedule data has not yet moved under data/json, and produced a 6-step implementation plan with exact file moves, loader refactor details, UI cleanup, README updates, testing flow, and @ema-implementer handoff. Saved to artifacts/2026-03-19-sage-branding-data-reorg-plan.md.",Working code produced — plan artifact completed with verified file targets and implementer handoff,[Time Spent],"Time saved ≈ 40-50% — AI handled repository verification, exact change scoping, and conversion of the architecture into an executable plan; human review still validates sequencing, docs scope, and the CSV fallback behavior (~25min AI-assisted vs ~45min manual)"
2026-03-19,Development,[Person],Copilot,[IDE],"Implement SAGE branding and repo-based data workflow — move schedule files under data/, remove upload UI, prefer CSV over JSON","ema-implementer executed the 6-step plan: moved root schedule files into data/json/day1.json and data/json/day2.json; added data/csv/.gitkeep to track the canonical CSV folder; updated config/sources.json to use logical source names; refactored js/loader.js to prefer data/csv/{name}.csv and fall back to data/json/{name}.json while preserving normalization and source metadata; removed upload UI from index.html and upload logic from app.js; updated SAGE branding in page titles; updated test.html and README.md; verified moved data counts, clean diagnostics, served HTML branding, JSON fallback loading, module smoke assertions, and CSV precedence via a temporary override file served through http-server.",Working code produced — 6/6 steps completed, 11 files created/modified plus 2 legacy files deleted, verification checks passing,[Time Spent],"Time saved ≈ 50-60% — AI handled coordinated file moves, loader refactoring, UI cleanup, verification scripting, and implementation reporting; developer still reviews browser behavior, docs wording, and edge-case expectations (~1h AI-assisted vs ~2.25h manual)"
2026-03-23,Testing,[Person],Copilot,[IDE],"Test SAGE branding and repo-based data workflow against requirements spec — no upload UI, canonical data folders, CSV-over-JSON loading, missing-source resilience, malformed committed CSV handling","ema-tester read requirements, architecture, plan, and implementation artifacts; reviewed existing smoke coverage in test.html; added tests/sage-spec-requirements.mjs with 5 new requirements-driven tests covering shipped SAGE branding, no file upload control, canonical data directory usage, logical source naming, JSON fallback, missing-source resilience, and malformed committed CSV handling. Ran full suite: existing 10 smoke assertions plus 5 new tests against a local static server. Confirmed 15 passed, 0 failed, 0 skipped. Residual gap: real browser DOM initialization could not be executed because no browser runtime is installed in the environment.",Good — 5 tests added covering all specified requirements and resilience cases, full suite 15/15 passing,[Time Spent],"Time saved ≈ 50-60% — AI generated targeted spec-based tests, assembled a runnable Node suite for static-site behavior, and executed regression checks quickly; developer still reviews assertion quality, browser-runtime gaps, and overall risk assessment (~45min AI-assisted vs ~1.75h manual)"
2026-03-23,Governance,[Person],Copilot,[IDE],"Review SAGE branding and repo-based data workflow — upload removal, CSV-preferred loader, data reorganization, SAGE branding (7 changed files)","ema-reviewer read all 5 upstream artifacts (requirements, architecture, plan, implementation summary, test report) and reviewed 7 changed files: js/loader.js, app.js, index.html, config/sources.json, README.md, test.html, tests/sage-spec-requirements.mjs. No critical or security findings. Found 3 warning-level issues: README.md H1 still reads pi-planning-v2 (incomplete SAGE branding in docs); runTest re-throws causing fail-fast test-suite termination on first failure; tests assert hardcoded event count of 72 instead of behavior-driven checks. Zero critical findings, zero security vulnerabilities. Plan adherence: 5 of 6 steps fully complete, 1 partial (README heading). Pipeline: ema-architect → ema-planner → ema-implementer → ema-tester → ema-reviewer.","Request Changes — 0 critical, 3 warnings (README heading, fail-fast test design, hardcoded event count), 3 info observations",[Time Spent],"Time saved ≈ 30-40% — AI systematically read all upstream artifacts and 7 changed files against EMA guidelines in one pass, caught README heading gap that slipped through both implementation and test stages, identified test design flaws; developer still validates business context, confirms architectural fitness, and applies fixes (~1h AI-assisted vs ~1.5-2h fully manual)"
2026-03-23,Governance,[Person],Copilot,[IDE],"Security audit of SAGE reviewed runtime and workflow files — reconnaissance, dependency coverage, code-pattern analysis, and infrastructure review","ema-security performed project-wide reconnaissance and targeted code-pattern review on the reviewed files plus related runtime surfaces and GitHub Actions workflows. Detected a static HTML/CSS/JavaScript site with no package manager manifests and two workflow files under .github/workflows. Verified npm was installed but no package.json or lockfile existed, so npm audit was not applicable; pip-audit, trivy, and grype were unavailable. Reviewed app.js, js/loader.js, js/renderer.js, js/url-state.js, index.html, config/sources.json, tests/sage-spec-requirements.mjs, and both workflows. Findings: 0 critical, 0 high, 1 medium (GitHub Pages workflow publishes the entire repository via path '.'), 2 low (missing explicit permissions block in copilot-setup-steps workflow; GitHub Actions pinned to mutable major tags instead of immutable SHAs). No code-level injection, XSS, auth, crypto, or secret-management vulnerabilities were found in the reviewed application code.","Findings — 1 medium and 2 low in GitHub Actions configuration; reviewed application code had no code-level security vulnerabilities",[Time Spent],"Time saved ≈ 45-55% — AI handled reconnaissance, tool coverage checks, workflow inspection, and systematic pattern review across the runtime and CI surfaces quickly; developer still validates severity, decides public exposure tolerance for Pages content, and prioritizes workflow hardening (~1h AI-assisted vs ~2h fully manual)"
2026-03-23,Technical architecture and design,[Person],Copilot,[IDE],"Plan follow-up fixes for reviewer comments on SAGE branding and requirements tests","Verified the reviewer findings against README.md and tests/sage-spec-requirements.mjs. Confirmed that the README H1 still says pi-planning-v2, the requirements test runner re-throws after recording failures, and two loader tests hardcode the current event count. Produced a 3-step follow-up implementation plan covering README branding alignment, non-fail-fast requirements test execution with a final process exit code, and data-independent loader assertions. Saved to artifacts/2026-03-23-sage-review-followups-plan.md with handoff for @ema-implementer-lite.","Working code produced — follow-up plan artifact completed with 3 implementation steps and implementer-lite handoff",[Time Spent],"Time saved ≈ 35-45% — AI verified the reviewer findings against the actual files, converted them into a concise executable fix plan, and preserved the artifact chain; developer still reviews the exact assertion strategy and decides when to execute the follow-up work (~20min AI-assisted vs ~35min manual)"
2026-03-23,Development,[Person],Copilot,[IDE],"Implement reviewer follow-up fixes for SAGE README branding and requirements tests","ema-implementer-lite executed the 3-step follow-up plan: updated README.md H1 from pi-planning-v2 to SAGE; modified tests/sage-spec-requirements.mjs so runTest records failures without re-throwing, added a final failCount-based process exit code, and replaced two hardcoded loader event-count assertions with behavior-driven checks using a non-empty assertion and a baseline load comparison. Verified README heading, confirmed no editor diagnostics in the modified test file, ran the requirements suite against a local static server, and saved the implementation summary to artifacts/2026-03-23-sage-review-followups-implementation.md.","Working code produced — 3/3 steps completed, 3 files modified, requirements suite passing 5/5",[Time Spent],"Time saved ≈ 40-50% — AI applied the reviewer-requested fixes quickly, preserved the artifact chain, and re-ran the targeted suite; developer still reviews the updated assertion strategy and decides whether to add a forced-failure regression case (~25min AI-assisted vs ~45min manual)"
2026-03-23,Testing,[Person],Copilot,[IDE],"Test reviewer follow-up fixes for SAGE branding and requirements-suite resilience against the follow-up plan","ema-tester read the follow-up plan, implementation summary, and requirements artifact; added tests/sage-review-followups-spec.mjs with 3 targeted regression tests covering README branding, non-fail-fast requirements runner behavior, and suite resilience when valid committed JSON data grows. Ran the full follow-up suite against a local static server: existing requirements suite 5/5 passing, new regression suite 2/3 passing. Key finding: tests/sage-spec-requirements.mjs still contains a hardcoded `37` event expectation in the malformed-CSV scenario, so the suite breaks when valid day 2 data grows. Saved the test report to artifacts/2026-03-23-sage-review-followups-test-report.md.","Needs Work — 3 tests added, full suite 7 passed / 1 failed; one remaining fragile hardcoded event-count assertion found in tests/sage-spec-requirements.mjs",[Time Spent],"Time saved ≈ 45-55% — AI added targeted regression coverage, exercised the suite under realistic data mutation, and exposed the remaining brittle assertion quickly; developer still reviews the appropriate invariant and decides how to revise the malformed-CSV expectation (~35min AI-assisted vs ~1.25h manual)"
2026-03-23,Development,[Person],Copilot,[IDE],"Review follow-up implementation for SAGE branding and requirements-suite data-independence fixes","ema-reviewer read 5 upstream artifacts (requirements, prior review report, follow-up plan, implementation, test report) and reviewed all 3 follow-up changed files (README.md, tests/sage-spec-requirements.mjs, tests/sage-review-followups-spec.mjs). Steps 1 and 2 confirmed complete. Step 3 found to be partial: the implementer fixed the =72 assertions in tests 3 and 4 but did not fix the equivalent =37 hardcode in test 5 (malformed-CSV scenario), which was confirmed broken by the tester regression suite. Identified 1 critical finding (test 5 hardcoded event count at tests/sage-spec-requirements.mjs:156) and 1 info-level note (undocumented legacy time-field usage in withTemporaryDay2Mutation). Saved review report to artifacts/2026-03-23-sage-review-followups-review-report.md.","Request Changes — 3 files reviewed, 1 critical (hardcoded 37 event count in test 5, plan step 3 partially unexecuted), 1 info-level note",[Time Spent],"Time saved 25-35% — AI read all artifacts and cross-referenced plan adherence, identified the exact remaining hardcoded line and its correct fix by pattern-matching against test 4 which used the same baseline technique, confirmed root cause; developer still validates that the proposed assertion captures the right behavioral invariant (~45min AI-assisted vs ~1-1.5h fully manual)"
2026-03-23,Architecture,[Person],Copilot,[IDE],"Architecture design for date-named data sources — rename data files from day1/day2 to YYYY-MM-DD, add label field in sources.json to map logical day names to date-keyed files","ema-architect explored config/sources.json, js/loader.js (loadSourceRecords, loadAllSources), app.js (updateTitle), data/json/ contents, and all 3 test files to map the full surface of the name field. Evaluated 3 approaches: (A) derive file stem from defaultDate implicitly, (B) derive from defaultDate with optional file override and rename name to label, (C) full path field per source. Recommended Approach B — rename name→label, derive file stem from defaultDate, rename data files to {date}.json. Produced architecture document with schema, data flow, integration points, testing strategy, and risks. Saved to artifacts/2026-03-23-date-named-sources-architecture.md with handoff for @ema-planner.","Working code produced — architecture document complete with chosen design, schema changes, data flow, integration points, testing strategy, and risk analysis",[Time Spent],"Time saved ≈ 45-55% — AI explored all loader, config, test, and app files systematically, identified every reference to the name field across 7 files, evaluated trade-offs between 3 approaches, and produced the full architecture document; developer still reviews schema decision and confirms the label vs name rename is desired (~30min AI-assisted vs ~1h fully manual)"
2026-03-23,Technical architecture and design,[Person],Copilot,[IDE],"Implementation planning for date-named source files mapped from logical day labels","ema-planner verified the architecture handoff against the live repo: confirmed config/sources.json still uses {name, defaultDate}, js/loader.js still builds file paths from sourceConfig.name, data/json/day1.json and data/json/day2.json exist, tests/sage-spec-requirements.mjs still asserts on name keys and uses withTemporaryCsv(\"day1\"), tests/sage-review-followups-spec.mjs still points to data/json/day2.json, and README.md still documents {name}-based path loading. Produced a 6-step implementation plan covering data-file renames, sources.json schema update, loader path derivation from defaultDate, test updates for the new label/date contract, the known hardcoded 37 test fix in the touched requirements suite, and README updates. Saved to artifacts/2026-03-23-date-named-sources-plan.md with handoff for @ema-implementer.","Working code produced — detailed 6-step plan saved with exact file paths, change descriptions, tests, and commit messages",[Time Spent],"Time saved ≈ 40-50% — AI verified the architecture against the actual repo, resolved one practical discrepancy by folding the known hardcoded-37 test fix into the relevant test-update step, and converted the design into an executable file-by-file plan; developer still reviews sequencing and confirms scope before implementation (~25min AI-assisted vs ~45-60min manual)"
2026-03-23,Development,[Person],Copilot,[IDE],"Implement date-named source-file design with logical labels mapped in sources.json","ema-implementer executed the 6-step plan: renamed data/json/day1.json and data/json/day2.json to 2026-03-17.json and 2026-03-18.json; updated config/sources.json from {name, defaultDate} to {label, defaultDate}; changed js/loader.js so loadSourceRecords derives file lookup paths from sourceConfig.file ?? sourceConfig.defaultDate and source-load fallback errors use label/defaultDate; updated tests/sage-spec-requirements.mjs for the new label schema and date-based file stems, including fixing the already-known brittle 37-count assertion with a baseline-derived expectation; updated tests/sage-review-followups-spec.mjs to point at the renamed day-2 fixture; updated README.md to document date-based file stems and that only configured dates are loaded. Ran both scripted suites against a local static server and saved the implementation summary to artifacts/2026-03-23-date-named-sources-implementation.md.","Working code produced — 6/6 steps completed, 7 files changed plus 2 file renames, requirements suite 5/5 and regression suite 3/3 passing",[Time Spent],"Time saved ≈ 45-55% — AI carried the schema, loader, fixture, test, and documentation changes through end-to-end implementation and verification, including folding in the previously known brittle-test fix while the file was already being updated; developer still reviews correctness, naming semantics, and future extensibility (~40min AI-assisted vs ~1.5h fully manual)"
2026-03-23,Testing,[Person],Copilot,[IDE],"Verify the date-named source contract from the spec side — configured dates only, CSV precedence, and missing-source messaging","ema-tester read the requirements, architecture, plan, and implementation artifacts; reviewed the existing requirements and regression suites; added tests/date-named-sources-spec.mjs with 3 targeted spec-driven tests covering unreferenced extra date files being ignored, configured CSV override over the matching date-named JSON file, and missing-source errors naming the attempted date-based paths for a logical label. Ran the full source-contract suite against a local static server: tests/sage-spec-requirements.mjs 5/5 passing, tests/sage-review-followups-spec.mjs 3/3 passing, tests/date-named-sources-spec.mjs 3/3 passing. Saved the test report to artifacts/2026-03-23-date-named-sources-test-report.md.","Good — 3 tests added, full suite 11 passed / 0 failed / 0 skipped, all requested source-contract behaviors covered",[Time Spent],"Time saved ≈ 50-60% — AI converted the spec into targeted regression tests, verified the full source-contract behavior in one pass, and checked edge cases around ignored files and CSV precedence quickly; developer still reviews assertion quality and confirms the coverage is sufficient (~35min AI-assisted vs ~1.5h fully manual)"
2026-03-23,Architecture,[Person],Copilot,[IDE],"Architecture design for decoupling name/teams from single team field in SAGE schedule viewer","ema-architect explored js/loader.js (normalizeRecord, parseCsv, createEventId, REQUIRED_FIELDS), js/filter.js (buildHierarchy, filterEvents, isGlobalPlenary, isSelectableTeam, getTeamValueStream, matchesSearch, sortEventsByStart), js/renderer.js (createRoomCard), app.js (buildScopeSelect, initializeApp), js/url-state.js, js/time-indicator.js, data/csv/2026-03-17.csv (new CSV with name/teams columns), data/json/2026-03-17.json and 2026-03-18.json (existing JSON for backward compat), config/sources.json, config/colors.json, styles.css, index.html, and all 4 test files. Evaluated 3 approaches: (A) array-based teams field with name, (B) comma-separated team string with name, (C) separate teams mapping in config. Recommended Approach A as cleanest model. Produced architecture document with normalized record shape, CSV column mapping, JSON backward compatibility strategy, filter logic updates, integration points by line number, error handling, testing strategy, and risks. Saved to artifacts/2026-03-23-name-teams-decoupling-architecture.md.","Working code produced — architecture document complete with full design, all integration points identified across 6 source files and 4 test files",[Time Spent],"Time saved ≈ 45-55% — AI explored all source files, mapped every event.team reference across the codebase, identified the CSV header discrepancy (teams plural, value stream with space), designed backward compat strategy for JSON files, and produced a detailed architecture; developer still reviews design decisions, confirms filter behavior for teamless events, and validates backward compat approach (~35min AI-assisted vs ~1.5h manual)"
