Date,Category,Person,Tool,IDE,Task / Use Case,AI Usage Description,Outcome,Time Spent,Estimated Impact
2026-03-23,Technical architecture and design,[Person],Copilot,[IDE],"Implementation planning for decoupling meeting name from team filters in SAGE schedule data","ema-planner read the architecture handoff artifact and verified the referenced files in the live repo: js/loader.js, js/filter.js, js/renderer.js, app.js, data/csv/2026-03-17.csv, data/json/2026-03-17.json, data/json/2026-03-18.json, README.md, and all 4 active Node-based test suites. It confirmed the new committed CSV uses headers name/value stream/teams, searched current code for event.team and rawRecord.team dependencies across js/** and tests/**, checked the current README data-contract wording, and derived the existing test workflow from the fetch-based test files and prior artifacts. Produced a 5-step implementation plan covering loader normalization, hierarchy/filter refactor, renderer display changes, test updates for both new CSV and legacy JSON contracts, and README documentation. Saved the plan to artifacts/2026-03-23-name-teams-decoupling-plan.md with a full handoff for @ema-implementer.","Working code produced — detailed 5-step plan saved with exact file paths, change descriptions, test expectations, and implementer handoff",[Time Spent],"Time saved ≈ 40-50% — AI verified the architecture handoff against the actual repo, located every live dependency on the overloaded team field, reconciled the real CSV header names with the design, and converted that into an executable file-by-file plan; developer still reviews sequencing, edge-case semantics for teamless events, and the transitional JSON compatibility strategy (~25min AI-assisted vs ~45-60min manual)"
2026-03-24,Testing,[Person],Copilot,[IDE],"Test name/teams decoupling against the feature spec — meeting name display, hidden filter-only teams, value-stream grouping, teamless inclusion, committed CSV 2026-03-17, and legacy JSON fallback","ema-tester wrote 4 new tests in tests/name-teams-decoupling-spec.mjs (2 committed-data filtering/hierarchy tests, 1 renderer/UI test, 1 legacy-compatibility test). Ran the full active suite against a local static server: tests/sage-spec-requirements.mjs 5/5, tests/date-named-sources-spec.mjs 3/3, tests/sage-review-followups-spec.mjs 3/3, tests/requirements.spec.mjs 4/4, tests/name-teams-decoupling-spec.mjs 4/4. Key findings: no product defects found; stabilized the new Windows test-runner shutdown path by using process.exitCode instead of hard process.exit.","Good — 4 tests added covering the decoupled name/team requirements, full suite 19/19 passing",[Time Spent],"Time saved ≈ 50-60% — AI translated the feature spec into committed-data and legacy-compatibility tests, exercised the full suite quickly, and exposed a test-runner shutdown issue before final handoff; developer still reviews assertion quality, behavior coverage, and any remaining migration work (~40min AI-assisted vs ~1.5h manual)"
2026-03-24,Architecture,[Person],Copilot,[IDE],"Architecture design for GitHub Actions Node.js 24 upgrade to eliminate deprecation warnings in Pages deployment workflow","ema-architect read .github/workflows/static.yml and .github/workflows/copilot-setup-steps.yml; fetched release/tag pages for actions/checkout, actions/configure-pages, actions/upload-pages-artifact, and actions/deploy-pages to determine latest versions and Node.js 24 support status. Found checkout@v6 and upload-pages-artifact@v4 have native Node.js 24 support; configure-pages@v5 and deploy-pages@v4 have no newer versions. Evaluated 3 approaches: (A) bump available versions + FORCE_JAVASCRIPT_ACTIONS_TO_NODE24 env var, (B) env var only, (C) version bumps only. Recommended Approach A. Produced architecture document covering both workflow files with version matrix, breaking change notes, and risk assessment. Saved to artifacts/2026-03-24-node24-actions-upgrade-architecture.md.","Working code produced — architecture document complete with version research, 3 design approaches, and full handoff for planner",[Time Spent],"Time saved ≈ 55-65% — AI fetched and verified latest releases for all 4 GitHub Actions from their release/tag pages, identified which have Node.js 24 support and which require the env var workaround, and produced the architecture document with breaking change analysis; developer still reviews version choices and confirms runner compatibility (~20min AI-assisted vs ~50min manual)"
2026-03-24,"Technical architecture and design",[Person],Copilot,[IDE],"Implementation planning for GitHub Actions Node.js 24 upgrade to eliminate Pages deployment deprecation warnings","ema-planner read the architecture artifact, verified .github/workflows/static.yml and .github/workflows/copilot-setup-steps.yml exist and match the described Node.js 20-era action versions, and reviewed a prior plan artifact to match repository planning format. Produced a 2-step implementation plan covering the workflow-level FORCE_JAVASCRIPT_ACTIONS_TO_NODE24 env addition in static.yml, action version upgrades to actions/checkout@v6 and actions/upload-pages-artifact@v4 where supported, the constrained checkout-only update in the Copilot setup workflow, manual GitHub Actions verification steps, and a focused @ema-implementer handoff. Saved to artifacts/2026-03-24-node24-actions-upgrade-plan.md.","Working code produced — detailed 2-step plan saved with exact workflow edits, validation steps, and implementer handoff",[Time Spent],"Time saved ≈ 40-50% — AI verified the architecture handoff against the live workflow files, reconciled the intentionally narrow scope for the scaffolded Copilot workflow, and converted the design into an executable plan with concrete edits and deployment-side verification; developer still reviews the exact env placement and GitHub-side validation results (~15min AI-assisted vs ~30min manual)"
2026-03-24,Development,[Person],Copilot,[IDE],"Implement GitHub Actions Node.js 24 upgrade for Pages deployment and Copilot setup workflows","ema-implementer executed the 2-step plan: updated .github/workflows/static.yml to add the top-level FORCE_JAVASCRIPT_ACTIONS_TO_NODE24 env override, upgraded actions/checkout from v4 to v6, upgraded actions/upload-pages-artifact from v3 to v4, and intentionally retained actions/configure-pages@v5 and actions/deploy-pages@v4 because no newer Node.js 24-native releases were available. Updated .github/workflows/copilot-setup-steps.yml to use actions/checkout@v6 while preserving the scaffolded workflow structure and comments. Verified both YAML files locally with editor diagnostics and direct file inspection, staged the workflow changes, and saved the implementation summary to artifacts/2026-03-24-node24-actions-upgrade-implementation.md.","Partial — 2 of 2 implementation steps completed, local YAML validation passed; GitHub-hosted workflow dispatch verification still pending from repository side",[Time Spent],"Time saved ≈ 35-45% — AI applied the workflow edits precisely, validated YAML structure immediately, and produced the implementation handoff; developer still needs to run the GitHub-side workflow dispatches and confirm warning removal and deployment behavior (~15min AI-assisted vs ~25-30min manual)"
2026-03-24,Testing,[Person],Copilot,[IDE],"Investigate duplicate ALL legend tags and verify getEventColor behavior against current renderer and color-map logic","ema-tester inspected js/renderer.js, js/filter.js, config/colors.json, and shipped CSV/JSON data to verify whether ALL uses a distinct color and why the page shows two visible ALL tags. Ran a direct Node.js runtime check of getEventColor with global plenary, non-plenary ALL, and unknown value-stream cases. Confirmed ALL resolves to the configured ALL color rather than _default, and identified the root cause of the duplicate visible labels: renderLegend maps global plenaries to _plenary but displays that bucket as ALL while non-plenary events retain literal vs=ALL, so both appear with the same label. Saved the findings to artifacts/2026-03-24-all-legend-duplication-test-report.md.","Good — focused runtime test completed, root cause identified, architect-ready report saved",[Time Spent],"Time saved ≈ 35-45% — AI traced the issue from runtime behavior through legend bucketing and shipped data semantics, then packaged the findings into an architect-ready report; developer still decides the desired UX contract and architecture direction (~15min AI-assisted vs ~25-30min manual)"
2026-03-24,Architecture,[Person],Copilot,[IDE],"Simplify legend and color assignment: remove _plenary concept from renderer/config, color by value stream only, keep _default for anomaly detection","ema-architect explored js/renderer.js, js/filter.js, config/colors.json, app.js, and 3 test files; mapped 6 integration points across renderer, config, and test fixtures; evaluated 3 design approaches (remove from renderer only vs remove isGlobalPlenary entirely vs normalize at load time); chose Approach A (renderer-only removal) per user direction; produced architecture document at artifacts/2026-03-24-legend-color-simplification-architecture.md","Working code produced — architecture document complete, 3 files to modify, 0 files to create",[Time Spent],"Time saved ≈ 45-55% — AI handled systematic codebase exploration across 8+ files and cross-referencing of integration points in minutes; developer provided clear design direction and validated approach (~20min AI-assisted vs ~40min manual)"
2026-03-24,Technical architecture and design,[Person],Copilot,[IDE],"Produce implementation plan for legend color simplification based on architecture handoff","ema-planner verified the architecture and upstream test-report artifacts, confirmed the referenced files exist, re-read the exact renderer/config/test integration points, derived the concrete test sequence used in this repo, and saved a 3-step implementation plan to artifacts/2026-03-24-legend-color-simplification-plan.md with a handoff for @ema-implementer","Working code produced — planning artifact complete, 4 files targeted, exact test commands captured",[Time Spent],"Time saved ≈ 35-45% — AI converted the architecture into an execution-ready plan with concrete file targets, regression commands, and non-goals in minutes; developer still reviews scope and implementation quality (~10-15min AI-assisted vs ~20-25min manual)"
2026-03-24,Development,[Person],Copilot,[IDE],"Implement legend color simplification: remove _plenary renderer/config path, keep _default fallback, add focused regression coverage","ema-implementer executed the 3-step plan: updated js/renderer.js to color and label by event.vs only, removed the _plenary entry from config/colors.json, removed the stale _plenary fixture usage from tests/name-teams-decoupling-spec.mjs, and added a focused legend/color regression test to tests/requirements.spec.mjs covering single ALL legend output plus _default fallback. Ran focused and full regression suites against a local static server, confirmed the focused requirements suite passes, and identified unrelated pre-existing source-data failures on data/csv/2026-03-18.csv during broader suite runs. Saved implementation summary to artifacts/2026-03-24-legend-color-simplification-implementation.md","Partial — 3 of 3 implementation steps completed; focused renderer requirements test passing, broader regression blocked by existing committed source-data failures",[Time Spent],"Time saved ≈ 35-45% — AI applied the localized renderer/config/test changes quickly, added targeted regression coverage, and separated true implementation validation from unrelated data-quality failures; developer still reviews UX and decides how to address the existing source-data issue (~20min AI-assisted vs ~35min manual)"
2026-03-24,Testing,[Person],Copilot,[IDE],"Test legend color simplification against the plan spec — value-stream-only colors, single legend entry per value stream, _default fallback, unchanged filter semantics","ema-tester wrote 2 new tests in tests/requirements.spec.mjs (renderer/type separation and shipped color-config contract). Ran full suite: 11 passed, 11 failed, 0 skipped. Verified the feature-specific requirements pass in the focused requirements suite and identified a separate committed-data issue at data/csv/2026-03-18.csv line 43 causing unrelated loader-based suite failures.","Needs Work — 2 tests added covering remaining renderer/color spec gaps, but full suite blocked by existing committed CSV validation failure at data/csv/2026-03-18.csv#L43",[Time Spent],"Time saved ≈ 45-55% — AI added targeted spec-driven tests, reran the full suite, and separated true feature coverage from pre-existing data-quality failures; developer still reviews test quality and decides whether to fix the committed CSV issue now (~25min AI-assisted vs ~50min manual)"
